Навание блюда;Состав;Картинка
Крабовые палочки в слоёном тесте;Отличная закуска для любителей блюд из крабовых палочек - крабовые палочки в слоёном тесте, с плавленым сыром. Слоёные рулетики выглядят очень аппетитно и внешне напоминают сосиски в тесте. На приготовление таких необычных слоек вам понадобится минимум времени. Как итог - хрустящее тесто с мягкой крабово-сырной начинкой.тесто слоеное, крабовые палочки, сыр плавленый, яйца;https://www.russianfood.com///img1.russianfood.com/dycontent/images_upl/583/sm_582365.jpg
Оладьи из зелёного горошка;Закусочные оладьи из замороженного зелёного горошка имеют насыщенный изумрудный цвет и необычный вкус. Такие яркие, необычные оладьи особенно понравятся любителям кулинарных экспериментов. Отличный вариант для завтрака или чтобы разнообразить повседневное меню!горошек зеленый мороженый, яйца, мука, молоко, разрыхлитель, куркума молотая, паприка молотая, тимьян (чабрец, богородская трава), соль, масло подсолнечное;https://www.russianfood.com///img1.russianfood.com/dycontent/images_upl/385/sm_384079.jpg
Икра из баклажанов с грибами и помидорами;"Икра ""заморская"", баклажанная, в этом рецепте органично сочетается с грибами и томатами. Процесс приготовления несложен: тушим-обжариваем ингредиенты и пюрируем до желаемой консистенции. Прекрасная вкусная закуска, она хороша к любому столу и в любом виде — тёплом и холодном, самостоятельно или как дополнение к основным блюдам. Новая классика в этом рецепте, для вас!баклажан, шампиньоны, помидоры, морковь, лук репчатый, чеснок, масло растительное, соль, перец чёрный молотый, сахар, зелень";https://www.russianfood.com///img1.russianfood.com/dycontent/images_upl/532/sm_531183.jpg
Салат из морской капусты с морковью и яйцом;Вкусный, лёгкий и в то же время довольно сытный салат из морской капусты с морковью, яйцом и зелёным луком. Такой салат готовится быстро и просто, в качестве заправки используется майонез. Ингредиенты салата отлично гармонируют друг с другом, получается намного вкуснее, чем обычная морская капуста!капуста морская, яйца, морковь, лук зелёный, майонез, соль, перец чёрный молотый;https://www.russianfood.com///img1.russianfood.com/dycontent/images_upl/594/sm_593637.jpg
Салат из свёклы, моркови, капусты и брынзы;Вкусный и лёгкий овощной салат с брынзой. Готовится такой яркий и аппетитный салат из свежей свеклы, моркови и капусты очень просто, а добавление брынзы обеспечивает привычному сочетанию овощей совершенно новый, оригинальный вкус.капуста белокочанная, свекла, морковь, брынза, соль, перец чёрный молотый, масло растительное;https://www.russianfood.com///img1.russianfood.com/dycontent/images_upl/490/sm_489985.jpg
Капустные вафли;Капустные вафли, приготовленные в электровафельнице, - блюдо вкусное, быстрое в приготовлении и достаточно оригинальное. Можно сказать, что это капустные котлеты, но в необычном исполнении. Хороши капустные вафли в качестве перекуса со сметаной или другим соусом.капуста белокочанная, яйца, мука, масло подсолнечное, лук зелёный, соль, перец чёрный молотый;https://www.russianfood.com///img1.russianfood.com/dycontent/images_upl/288/sm_287376.jpg
Макароны с капустой (на сковороде);"Интересный вариант бюджетного обеда - макароны с капустой в сковороде. Если пробовать это блюдо с закрытыми глазами, создаётся впечатление, что это вареники с капустой. Такие макароны с капустой и правда очень похожи по вкусу на вареники, только готовятся даже ещё проще и быстрее ленивых вареников. Никакого замеса, раскатки или формовки теста для таких ""ленивых вареничков"" не  потребуется. Оригинально и весьма экономно!макароны, капуста, лук репчатый, морковь, зелень укропа, чеснок, соль, перец чёрный молотый, масло растительное";https://www.russianfood.com///img1.russianfood.com/dycontent/images_upl/566/sm_565442.jpg
Тыква, запечённая с сыром, в беконе;Оригинальная закуска на скорую руку всего из четырёх ингредиентов. Красочные ломтики тыквы слегка поджариваются, а затем запекаются с беконом и сыром. Лёгкая сладость тыквы удачно оттеняет солоноватый вкус сыра и ароматного бекона. За несколько минут получается яркая и необычная закуска. Попробуйте!тыква, сыр твёрдый, бекон, масло растительное;https://www.russianfood.com///img1.russianfood.com/dycontent/images_upl/457/sm_456590.jpg
Каппельский молочный суп;Каппельский молочный суп - блюдо с историей, а точнее, часть истории Швейцарии. В этой стране даже установлен монумент в память о событии, когда в городке Каппель в 1539 году солдатами двух противоборствующих армий был приготовлен суп из молока и хлеба, ставший символом их примирения... Этот рецепт - вариация на тему каппельского супа - молочный суп с хлебом, жареным луком, пряностями, сыром и зеленью.молоко, бульон, хлеб, лук репчатый, чеснок, масло сливочное, семена тмина, гвоздика, лавровый лист, перец чёрный молотый, соль, сыр твёрдый, лук зелёный...;https://www.russianfood.com///img1.russianfood.com/dycontent/images_upl/530/sm_529135.jpg
Омлетные рулетики с паштетом;Фаршированные яйца на новый лад - омлетные рулетики с паштетом. Такие рулетики готовятся просто, быстро, из минимального количества продуктов и одинаково хороши как на завтрак, так и в качестве незатейливой закуски для приёма неожиданных гостей. Вкусно и недорого!яйца, паштет печеночный, паприка молотая, соль, перец чёрный молотый, масло растительное;https://www.russianfood.com///img1.russianfood.com/dycontent/images_upl/588/sm_587772.jpg
Макароны с творогом (на сковороде);Необычный вариант привычного блюда – макароны как с сыром... но без сыра! В основе макарон с творогом всего три ингредиента, но благодаря интересному способу приготовления блюдо получается по вкусу и текстуре и правда очень похожим на макароны с сыром. Такие макароны готовятся в одной сковороде – получается просто, быстро и бюджетно!макароны, творог, соль, зелень укропа, перец чёрный молотый;https://www.russianfood.com///img1.russianfood.com/dycontent/images_upl/548/sm_547534.jpg
Мясной рулет с рисом и яйцами;"Рулет из мясного фарша с рисом и начинкой из варёных яиц, запечённый в фольге в духовке, - блюдо не только очень вкусное, но и весьма эффектное в подаче! Такой мясной ""батон"" можно смело подавать на праздничный стол и особенно уместно он впишется в пасхальное меню. Оригинально и вполне бюджетно!фарш мясной, рис, яйца, лук репчатый, зелень петрушки, порошок чесночный, паприка молотая, кориандр, соль, перец чёрный молотый, масло растительное";https://www.russianfood.com///img1.russianfood.com/dycontent/images_upl/500/sm_499195.jpg
Запеканка из куриной печени с помидором и яблоком;Запеканка по этому рецепту готовится из куриной печени, обжаренной с помидорами и яблоком, и яичной заливки. Блюдо получается очень нежным и довольно сытным – любителям куриной печени обязательно понравится.печень куриная, помидоры, яблоко, яйца, масло растительное, соль, перец чёрный молотый, зелень, вода;https://www.russianfood.com///img1.russianfood.com/dycontent/images_upl/421/sm_420972.jpg
Пирог из лаваша с творогом и сыром (на сковороде);Вкуснейшая выпечка без духовки - это вполне реально. Пирог, приготовленный на сковороде, получается ничем не хуже испечённого в духовке. Понадобится лишь тонкий лаваш, много творога и немного сыра. Чтобы пирог из лаваша получился нежным и мягким, добавим к творожной начинке кефир, а также используем яичную заливку.лаваш, творог, сыр твёрдый, яйца, кефир, сахар, соль, масло сливочное, масло растительное;https://www.russianfood.com///img1.russianfood.com/dycontent/images_upl/574/sm_573782.jpg
Салат из капусты с орехами и лапшой быстрого приготовления;"Хрустящий салат с довольно необычным сочетанием ингредиентов – ""студенческий"" салат из капусты с орехами и лапшой быстрого приготовления. Такой салат примечателен тем, что лапша для него не запаривается, а добавляется в сухом виде. Арахис добавляет салату сытности, а пикантную нотку придаст зелёный лук. Получается странно, но очень вкусно.капуста белокочанная, лапша, арахис, лук зелёный, кунжут, масло растительное, сахар, соль, перец чёрный молотый";https://www.russianfood.com///img1.russianfood.com/dycontent/images_upl/557/sm_556851.jpg
Салат из солёных огурцов и лука;Простой салат из солёных огурцов и репчатого лука – универсальная закуска, которую можно приготовить всего за 10 минут. Такой бюджетный, вкусный и хрустящий салатик – удачнейшее дополнение к жареной картошке или мясу.огурцы солёные, лук репчатый, масло подсолнечное, сахар, соль, перец чёрный молотый;https://www.russianfood.com///img1.russianfood.com/dycontent/images_upl/586/sm_585366.jpg
Двухслойный омлет с консервированной кукурузой;Омлет, как и яичница, - рекордсмен среди завтраков! Но простой омлет ни в какое сравнение не пойдёт с двухслойным омлетом, в виде рулета с начинкой. Сегодня в качестве начинки используем консервированную кукурузу. Получится яркое, сытное и очень вкусное блюдо из минимального набора продуктов!яйца, кукуруза консервированная, соль, перец чёрный молотый, масло растительное;https://www.russianfood.com///img1.russianfood.com/dycontent/images_upl/584/sm_583535.jpg
Конвертики из лаваша с гречкой, грибами и луком;Румяные конвертики из лаваша с гречкой и грибами станут отличным завтраком или перекусом. Такую закуску очень удобно брать с собой на работу или пикник.лаваш, крупа гречневая, вешенки свежие, лук репчатый, соус соевый, масло растительное, зелень петрушки;https://www.russianfood.com///img1.russianfood.com/dycontent/images_upl/384/sm_383559.jpg
Вареники с вишней и творогом;Чаще готовят вареники либо с творогом, либо только с вишней. В этот раз совместим два этих отличных варианта. Яркость вкуса вишни смягчится нежным творогом в начинке. Процесс приготовления вполне привычный, а вкус вареников с творогом и вишней будет и новым, и знакомым одновременно. Это интересно и вкусно!мука, вода, соль, вишня, творог, желток, сахар;https://www.russianfood.com///img1.russianfood.com/dycontent/images_upl/519/sm_518218.jpg
Картофельное пюре со сметаной;Картофельное пюре со сметаной и сливочным маслом имеет более выраженный вкус в отличие от пюре с молоком или сливками. В нём присутствует лёгкая, еле уловимая кислинка, которая ни в коем случае не портит блюдо, а наоборот - делает его вкус интереснее. Бюджетный и очень вкусный гарнир!картофель, сметана, масло сливочное, соль;https://www.russianfood.com///img1.russianfood.com/dycontent/images_upl/487/sm_486875.jpg
Фаршированный картофель;Запеченный картофель, фаршированный курицей и перцем, можно подать на праздничный стол или на обед, ужин. Очень вкусно, полезно, необычно и красиво.картофель, куриная грудка, лук репчатый, перец болгарский красный, сыр твёрдый, зелень петрушки, чеснок, масло сливочное, масло растительное, соль, перец чёрный молотый;https://www.russianfood.com///img1.russianfood.com/dycontent/images_upl/224/sm_223773.jpg
Закусочные слойки с печёночным паштетом и сыром;Мегабыстрые закусочные слойки с печёночным паштетом и сыром! Тесто будем использовать готовое слоёное, с приготовлением начинки тоже заморачиваться не придётся - отлично подойдёт любой магазинный паштет. Слоечки получаются очень вкусными, подойдут и для перекуса с чаем или кофе, и на замену хлебу к первым блюдам!тесто слоеное, паштет печеночный, сыр твёрдый, яйца, мука пшеничная;https://www.russianfood.com///img1.russianfood.com/dycontent/images_upl/419/sm_418158.jpg
Горячие бутерброды с сосисками и сыром (на сковороде);Замечательный рецепт невероятно простых и быстрых горячих бутербродов без духовки - на сковороде. Сосиски и сыр на румяных и поджаристых греночках - как раз то, что нужно для плотного и сверхсытного завтрака или перекуса, который можно взять с собой на работу или дать ребёнку в школу.сосиски, хлеб белый, сыр твёрдый, яйца, сметана, зелень укропа, соль, масло растительное, тимьян (чабрец, богородская трава);https://www.russianfood.com///img1.russianfood.com/dycontent/images_upl/363/sm_362008.jpg
Бутерброды с творогом, яйцами и зеленью;Вкусная весенняя закуска из простых ингредиентов - бутерброды с творогом, яйцами и зеленью. Основа из творога и варёных яиц отлично дополняется большим количеством петрушки и ароматной черемши. Получается сочно, вкусно и сытно. Стоит попробовать!хлеб, творог, яйца, черемша, зелень петрушки, соль, перец чёрный молотый;https://www.russianfood.com///img1.russianfood.com/dycontent/images_upl/593/sm_592091.jpg
Фаршированные бутерброды с консервированной рыбой и варёными яйцами;Простой рецепт фаршированных бутербродов с консервированной рыбой и варёными яйцами - для завтрака и не только. Обычно, чтобы начинка хорошо держалась внутри таких бутербродиков, в неё добавляют сливочное масло или плавленый сыр. Но тут они не понадобятся - и всё благодаря небольшой хитрости. Три основных ингредиента, несложное приготовление и симпатичный вид - прекрасный вариант вполне бюджетной закуски!хлеб, рыба консервированная, яйца, соль, перец чёрный молотый;https://www.russianfood.com///img1.russianfood.com/dycontent/images_upl/596/sm_595815.jpg
Рулет из лаваша с капустой  и сыром (в духовке);Рулет из лаваша с капустой и сыром - простой домашний рецепт вкусного и лёгкого в приготовлении блюда для завтрака или перекуса. Рулет запекается в духовке, лаваш становится хрустящим, внутри расплавляется сыр, в сочетании с сочной тушёной капустой получается очень вкусно.капуста белокочанная, морковь, лук репчатый, томат-паста, сыр моцарелла, лаваш, соль, перец чёрный молотый, масло растительное;https://www.russianfood.com///img1.russianfood.com/dycontent/images_upl/327/sm_326455.jpg
Кабачки, тушенные с морковью на сковороде;Лёгкое овощное блюдо - кабачки, тушенные с морковью и зеленью. Благодаря недолгому обжариванию в сковороде, овощи остаются приятно хрустящими. Попробуйте - вам понравится!кабачки, морковь, зелень петрушки, зелень укропа, чеснок, соль, перец чёрный молотый, масло растительное;https://www.russianfood.com///img1.russianfood.com/dycontent/images_upl/523/sm_522045.jpg
Блинная кутья с маком, изюмом и орехами;Классический вариант кутьи готовится из зёрен пшеницы или ячменя. Вместо пшеничных зёрнышек используем румяные вкусные блинчики. Необычная кутья из блинов с маком, изюмом и орехами - прекрасный способ порадовать гостей за рождественским столом угощением с новым вкусом! Такой оригинальный десерт улетит за считанные минуты.мак, изюм, орех грецкий, мёд, цедра апельсиновая, молоко, вода, яйца, мука, масло растительное, соль;https://www.russianfood.com///img1.russianfood.com/dycontent/images_upl/571/sm_570546.jpg
Картошка, жаренная с куриным филе в пергаменте;"Рецепт ""два в одном"" - куриная грудка, приготовленная вместе с картошкой в пергаменте на сковороде. Куриное филе получается нежным, сочным, совершенно не сухим. А натёртый картофель с пряностями аппетитно прижаривается. И всё это - при минимальном использовании масла!картофель, куриное филе, куркума молотая, паприка молотая, соль, перец чёрный молотый, масло растительное";https://www.russianfood.com///img1.russianfood.com/dycontent/images_upl/588/sm_587540.jpg
Фриттата с цуккини и спаржей;"Итальянский омлет ""фриттата"" всегда выгодно смотрится на столе.спаржа, перец болгарский желтый, лук репчатый, цуккини, яйца, сливки, молоко, петрушка, соль, перец чёрный молотый, сыр твёрдый";https://www.russianfood.com///img1.russianfood.com/dycontent/images_upl/45/sm_44125.jpg
