Навание блюда;Состав;Картинка
Каша из жареной манной крупы, с консервированной кукурузой;Оригинальная каша из жареной манной крупы, с консервированной кукурузой. Вкус и консистенция у такой каши - очень интересные. Благодаря обжариванию манка не склеивается в однородную массу, а ощущается отдельными крупинками. Обжаренная манка добавляет ореховые нотки, которые сочетаются с яркими кукурузными. Стоит попробовать - это интересно, вкусно и сытно!кукуруза консервированная, крупа манная, вода, соль, масло сливочное;https://www.russianfood.com///img1.russianfood.com/dycontent/images_upl/598/sm_597258.jpg
Блинчики с плавленым сыром и зеленью;Отличный вариант сытного завтрака - блинчики на сметане, с вкусной сырной начинкой. С таким вкусным началом день точно будет замечательным!яйца, мука, сметана, соль, перец чёрный молотый, сыр плавленый, зелень, зелень укропа;https://www.russianfood.com///img1.russianfood.com/dycontent/images_upl/595/sm_594177.jpg
Оладьи из кабачковой икры;"Немногие знают, что кабачковую икру можно использовать таким оригинальным способом - приготовить из неё оладьи! Так что если ещё не наступил сезон свежих кабачков и вдруг ""завалялась"" баночка кабачковой икры, воспользуйтесь этим рецептом быстрых кабачковых оладий. Оладьи из кабачковой икры получаются пышные, нежные, ароматные и очень вкусные!икра кабачковая, яйца, мука, крупа манная, сухари панировочные, сода, лимонная кислота, зелень укропа, соль, травы сухие итальянские, масло растительное";https://www.russianfood.com///img1.russianfood.com/dycontent/images_upl/598/sm_597864.jpg
Паштет из куриного филе с копчёным сыром;Сытный, вкусный и нежный паштет из куриного филе с копчёным сыром и солёным салом. Такой куриный паштет можно подать к завтраку с ломтиками поджаренного хлеба либо использовать для  фаршировки яиц, пресных профитролей или блинов.куриное филе, сало солёное, сыр копченый, лук репчатый, морковь, масло растительное, масло сливочное, лавровый лист, орех мускатный, соль, перец чёрный молотый;https://www.russianfood.com///img1.russianfood.com/dycontent/images_upl/597/sm_596908.jpg
Бобовые оладьи с припёком из сосисок;Не рецепт, а находка - оладьи из консервированной фасоли с симпатичным припёком из сосисок. Готовятся такие фасолевые оладьи быстро, а по вкусу чем-то похожи на смесь картофельного пюре и варёной куриной грудки. Кружочки сосисок в виде припёка делают оладьи аппетитнее и отлично их дополняют.фасоль консервированная, мука, яйца, сосиски, зелень укропа, соль, перец чёрный молотый, масло растительное;https://www.russianfood.com///img1.russianfood.com/dycontent/images_upl/583/sm_582771.jpg
Рулет из куриной печени, с сыром;Паштет из куриной печени, который приготовлен в виде рулета с начинкой из сыра, масла и яиц.печень куриная, сметана, лук репчатый, яйца, мука, сыр, масло сливочное, орех мускатный, соль, перец чёрный молотый, масло растительное;https://www.russianfood.com///img1.russianfood.com/dycontent/images_upl/214/sm_213956.jpg
Пирог на кефире, с овощами;Пёстрый закусочный кекс-пирог на кефире – просто находка для тех, кто предпочитает несладкую выпечку и ищет альтернативу хлебу к первым блюдам. Пирог очень вкусный, но его особая изюминка в начинке: кусочки разноцветных овощей (в этом рецепте – микс замороженной кукурузы, стручковой фасоли, горошка и моркови) равномерно распределены в пористой и слегка влажной выпечке, делая срез очень красивым, а вкус – приятным и таким ощутимо овощным. Этот кекс однозначно стоит попробовать!кефир, яйца, овощи мороженые, мука, разрыхлитель, соль;https://www.russianfood.com///img1.russianfood.com/dycontent/images_upl/575/sm_574671.jpg
Несладкий молочный суп с картофельными клёцками и морковью;Оригинальный вариант привычного блюда – несладкий молочный суп с морковью и картофельными клёцками. Такой сытный молочный супчик с овощами – прекрасное решение для бюджетного меню, ведь продукты в основе вполне доступные, да и приготовить суп совсем несложно. Добавление моркови придаёт блюду лёгкую сладковатую нотку, которая очень хорошо сочетается с молоком. Вкусно и ярко!молоко, морковь, лук репчатый, картофель, мука, яйца, соль, перец чёрный молотый, масло растительное, зелень петрушки;https://www.russianfood.com///img1.russianfood.com/dycontent/images_upl/579/sm_578841.jpg
Картофельные оладьи на кефире;Сытное и вкусное блюдо на все случаи жизни – картофельные оладьи на кефире. Основа из кефира делает оладьи нежными и пышными, а картофель обеспечивает питательность. Просто и бюджетно!картофель, кефир, яйца, мука, сода, хмели-сунели, соль, перец чёрный молотый, масло растительное;https://www.russianfood.com///img1.russianfood.com/dycontent/images_upl/590/sm_589171.jpg
Закусочный блинный торт с селедочным паштетом;Рецепт закусочного блинного торта с начинкой из селедочного паштета.блинчики, сельдь соленая, лук репчатый, морковь, яйца, сыр сливочный, сметана, масло растительное, зелень петрушки;https://www.russianfood.com///img1.russianfood.com/dycontent/images_upl/324/sm_323791.jpg
Пирожки из лаваша с капустой и яйцами;Для любителей румяных пирожков - аппетитные и очень быстрые треугольники из лаваша с капустой и яйцами. Такие ленивые пирожки из лаваша с ароматной начинкой из яиц и капусты и готовятся, и съедаются просто молниеносно. Вкуснее всего подавать пирожки прямо со сковородки - с пылу с жару!лаваш, капуста, яйца, соль, масло растительное;https://www.russianfood.com///img1.russianfood.com/dycontent/images_upl/594/sm_593635.jpg
Суфле из куриного филе с кабачком, морковью и укропом;Рецепт диетического куриного суфле для любителей правильного питания. Суфле получается очень нежным и воздушным. Вкрапления моркови и укропа придают суфле яркий внешний вид, а кабачок добавляет сочность.куриное филе, кабачки, морковь, яйца, зелень укропа, чеснок, масло растительное, соль, перец чёрный молотый;https://www.russianfood.com///img1.russianfood.com/dycontent/images_upl/597/sm_596548.jpg
Лаваш с капустой, крабовыми палочками и огурцом;Лаваш с капустой, крабовыми палочками и огурцом — сытный перекус на протяжении всего дня. Лаваш можно взять с собой на работу, в дорогу, на пикник. Овощи в начинке отлично гармонируют и дополняют друг друга, а крабовые палочки делают вкус более ярким. Сочная и ароматная начинка хорошо сочетается с тонким лавашом.лаваш, крабовые палочки, капуста белокочанная, майонез, огурцы, соль, перец чёрный молотый;https://www.russianfood.com///img1.russianfood.com/dycontent/images_upl/597/sm_596077.jpg
Запеканка с картофелем, перцем и сардельками (на сковороде);Бывают ситуации, когда готовить в духовке нет возможности. В жару не хочется этого излишнего жара, который от нее исходит. Запеканка на сковороде поможет разнообразить рацион. Она получается очень вкусной. Запеканка из картофеля со свежим болгарским перцем очень аппетитно выглядит.картофель, мука пшеничная, сардельки, яйца, сыр твёрдый, помидоры, перец болгарский, зелень, соль, перец душистый молотый, масло подсолнечное;https://www.russianfood.com///img1.russianfood.com/dycontent/images_upl/144/sm_143549.jpg
Ложные чебуреки из фарша с грибами и плавленым сыром;"Интересный вариант для обеда – ложные чебуреки с грибами и сыром. Такие необычные куриные котлеты-""чебуреки"" жарятся в сковороде с минимумом растительного масла и получаются намного сочнее привычных котлет. Фарш вместо теста, а внутри – начинка из грибов и плавленого сыра. Вкусно и оригинально!фарш куриный, шампиньоны, сыр плавленый, лук репчатый, сухари панировочные, соль, перец чёрный молотый, масло растительное";https://www.russianfood.com///img1.russianfood.com/dycontent/images_upl/561/sm_560669.jpg
Паштет из куриных сердечек с морковкой и луком;Всем привет, друзья! Сегодня хочу предложить вам рецепт обалденного домашнего паштета из куриных сердечек с луком и морковкой. Получается он невероятно нежным. Подавать паштет можно как закуску, или же использовать для начинки в блины. Идеально подходит на завтрак к чаю!сердце куриное, лук репчатый, морковь, масло растительное, масло сливочное, хмели-сунели, куркума, лавровый лист, перец чёрный горошком, соль, перец чёрный молотый, вода;https://www.russianfood.com///img1.russianfood.com/dycontent/images_upl/590/sm_589093.jpg
Борщ без мяса (на сыворотке);Очень вкусный постный борщ получается благодаря добавлению сыворотки. Борщ на сыворотке выглядит ещё ярче, а его вкус более насыщенный. Сыворотка придаёт необходимую кислинку, за счёт которой хорошо сохраняется и цвет борща. Даже при отсутствии мяса, постный борщ на сыворотке очень вкусный, лёгкий, но в то же время достаточно сытный.картофель, свекла, капуста белокочанная, морковь, лук репчатый, томат-паста, сыворотка молочная, перец душистый горошком, лавровый лист, соль, масло растительное...;https://www.russianfood.com///img1.russianfood.com/dycontent/images_upl/594/sm_593114.jpg
"Закуска из солёных огурцов ""как грибы""";Из солёных огурцов, моркови и лука можно приготовить очень интересную закуску, напоминающую грибную икру. И действительно, хотя грибы не входят в состав используемых ингредиентов, их вкус и аромат улавливается. Помимо овощей нам понадобится немного майонеза для придания намазке нужной консистенции. Также добавим чеснок для аромата.огурцы солёные, лук репчатый, морковь, майонез, чеснок, соль, перец чёрный молотый, масло растительное;https://www.russianfood.com///img1.russianfood.com/dycontent/images_upl/586/sm_585537.jpg
Яичница с индейкой и помидорами;Сытный и красивый завтрак - яичница с индейкой и помидорами. Готовится такая яичница элементарно, а выглядит ярко и чрезвычайно аппетитно. Кусочки индюшиного мяса получаются невероятно нежными и сочными. Красочно, питательно и очень вкусно!филе индейки, яйца, помидоры, соль, перец чёрный молотый, зелень петрушки, масло растительное;https://www.russianfood.com///img1.russianfood.com/dycontent/images_upl/553/sm_552192.jpg
Булочки с начинкой из колбасы, помидоров и сыра;"Простой способ превратить завтрак в настоящий праздник - фаршированные булочки ""Цветочки"". Красивые и хрустящие булочки с аппетитной начинкой - это сытно, вкусно и очень симпатично!булочка, колбаса вареная, помидоры, сыр твёрдый, кетчуп";https://www.russianfood.com///img1.russianfood.com/dycontent/images_upl/585/sm_584868.jpg
Ленивые вареники с цедрой и сметанно-апельсиновым соусом;Творожные ленивые вареники — вкусный и полезный завтрак или полдник, любимый многими с детства. А если приготовить их с ароматом апельсина да со сметанно-апельсиновым соусом, то будет ещё аппетитнее. Остывшие или разогретые повторно варенички под сметанно-апельсиновым соусом по-прежнему вкусны.мука, масло сливочное, яйца, творог, цедра апельсиновая, сахар, соль, сметана, сок апельсиновый, сахар, сахар ванильный;https://www.russianfood.com///img1.russianfood.com/dycontent/images_upl/529/sm_528138.jpg
Драники с квашеной капустой;Интересный взгляд на привычное блюдо - картофельные драники с квашеной капустой. Вполне традиционное сочетание картошки и квашеной капусты в таких оригинальных драниках открывается с новой стороны. Толстенькие и сочные дранички скорее даже напоминают котлетки и получаются румяными, с аппетитной хрустящей корочкой и нежные внутри. Просто, вкусно и бюджетно!капуста квашеная, картофель, лук репчатый, мука, молоко, яйца, соль, перец чёрный молотый, масло растительное;https://www.russianfood.com///img1.russianfood.com/dycontent/images_upl/553/sm_552820.jpg
Пшённая каша с кабачками;Простое и вкусное блюдо. Пшённая каша и сочные кабачки с морковью и луком - хорошее сочетание. Неплохой вариант гарнира или вполне самостоятельное вегетарианское блюдо.пшено, кабачки, морковь, лук репчатый, соль, перец чёрный молотый, масло растительное;https://www.russianfood.com///img1.russianfood.com/dycontent/images_upl/527/sm_526107.jpg
Рис с малосольными огурцами и зеленью;Питательное блюдо для летнего меню - рис с малосольными огурцами и зеленью. Отваренный рис, малосольные огурчики, зелёный лук и укроп прекрасно сочетаются между собой. Получается лёгкий и оригинальный вегетарианский салат со сбалансированным вкусом.рис длиннозерный, огурцы малосольные, лук зелёный, зелень укропа, масло растительное, сок лимона, соль, перец чёрный молотый;https://www.russianfood.com///img1.russianfood.com/dycontent/images_upl/521/sm_520255.jpg
Вареники с брокколи и сыром фета;Если вы любите вареники, то как насчёт того, чтобы попробовать что-то необычное? Приготовим вареники из теста на сметане и яичных желтках, с начинкой из брокколи с сыром фета. Почти пюреобразная начинка придётся по вкусу поклонникам зелёной брокколи и солоноватой феты. Привычный процесс лепки и варки не удивит чем-то новым, вот вкус — наверняка.мука, желток, сметана, вода, соль, капуста брокколи, сыр фета, чеснок, соль, перец чёрный молотый, масло сливочное, лук репчатый;https://www.russianfood.com///img1.russianfood.com/dycontent/images_upl/530/sm_529028.jpg
Творожная запеканка с помидорами, яйцами и сыром;Вкусная и нежная несладкая запеканка для любителей блюд из творога. Творожно-сырно-яичная часть запеканки прекрасно сочетается c помидорами и чесноком. Разница структур двух слоёв играет ещё и разными вкусами: нежный, сливочный и слегка кислый помидорно-чесночный приятно удивят ваши вкусовые рецепторы.)помидоры, сыр пармезан, яйца, сыр фета, творог, сметана, чеснок, масло оливковое, соль, масло сливочное, базилик;https://www.russianfood.com///img1.russianfood.com/dycontent/images_upl/526/sm_525971.jpg
Яичный салат с виноградом, плавленым сыром и чесноком;Несложный и весьма оригинальный яичный салат с виноградом, плавленым сыром и чесноком. Добавление винограда привносит приятную освежающую нотку в привычное для салатов сочетание яиц и сыра. Минимум доступных ингредиентов, простое приготовление, а в результате - отличный салат с необычным сочетанием вкусов.яйца, виноград, сыр плавленый, чеснок, майонез, соль;https://www.russianfood.com///img1.russianfood.com/dycontent/images_upl/540/sm_539777.jpg
Котлеты из свеклы и яблока;Рецепт котлет из свёклы с яблоком и луком, с добавлением манной крупы. Яркие овощные котлеты с интересным вкусовым сочетанием готовятся несложно, а получаются вкусными и нежными. Яблоки обеспечивает свекольным котлеткам дополнительную сочность, аромат и приятную кислинку.свекла, яблоко, лук репчатый, крупа манная, яйца, чеснок, соль, перец чёрный молотый, масло растительное;https://www.russianfood.com///img1.russianfood.com/dycontent/images_upl/541/sm_540266.jpg
Жареные макароны с яйцом, сметаной и горчицей;Жареные макароны с яйцом, сметаной и горчицей — сытный гарнир, который можно подать самостоятельно или как дополнение к мясным и рыбным блюдам.макароны, яйца, сметана, горчица, соль, перец чёрный молотый, масло растительное;https://www.russianfood.com///img1.russianfood.com/dycontent/images_upl/596/sm_595187.jpg
Несладкий молочный суп с ломтиками запечённого риса с сыром;Очень интересное блюдо - молочный суп с ломтиками запечённого риса с сыром. Суп несладкий и не похож на остальные молочные супы. Запечённый рис с сыром напоминает фрикадельки и отлично сочетается с несладкой молочной основой с добавлением паприки. Супчик получается питательным, ароматным и очень вкусным!молоко, рис, яйца, сыр твёрдый, масло сливочное, паприка молотая, соль, сухари панировочные;https://www.russianfood.com///img1.russianfood.com/dycontent/images_upl/521/sm_520458.jpg
