Навание блюда;Состав;Картинка
Закусочный блинный торт с селедочным паштетом;Рецепт закусочного блинного торта с начинкой из селедочного паштета.блинчики, сельдь соленая, лук репчатый, морковь, яйца, сыр сливочный, сметана, масло растительное, зелень петрушки;https://www.russianfood.com///img1.russianfood.com/dycontent/images_upl/324/sm_323791.jpg
Пирожки из лаваша с капустой и яйцами;Для любителей румяных пирожков - аппетитные и очень быстрые треугольники из лаваша с капустой и яйцами. Такие ленивые пирожки из лаваша с ароматной начинкой из яиц и капусты и готовятся, и съедаются просто молниеносно. Вкуснее всего подавать пирожки прямо со сковородки - с пылу с жару!лаваш, капуста, яйца, соль, масло растительное;https://www.russianfood.com///img1.russianfood.com/dycontent/images_upl/594/sm_593635.jpg
Суфле из куриного филе с кабачком, морковью и укропом;Рецепт диетического куриного суфле для любителей правильного питания. Суфле получается очень нежным и воздушным. Вкрапления моркови и укропа придают суфле яркий внешний вид, а кабачок добавляет сочность.куриное филе, кабачки, морковь, яйца, зелень укропа, чеснок, масло растительное, соль, перец чёрный молотый;https://www.russianfood.com///img1.russianfood.com/dycontent/images_upl/597/sm_596548.jpg
Лаваш с капустой, крабовыми палочками и огурцом;Лаваш с капустой, крабовыми палочками и огурцом — сытный перекус на протяжении всего дня. Лаваш можно взять с собой на работу, в дорогу, на пикник. Овощи в начинке отлично гармонируют и дополняют друг друга, а крабовые палочки делают вкус более ярким. Сочная и ароматная начинка хорошо сочетается с тонким лавашом.лаваш, крабовые палочки, капуста белокочанная, майонез, огурцы, соль, перец чёрный молотый;https://www.russianfood.com///img1.russianfood.com/dycontent/images_upl/597/sm_596077.jpg
Запеканка с картофелем, перцем и сардельками (на сковороде);Бывают ситуации, когда готовить в духовке нет возможности. В жару не хочется этого излишнего жара, который от нее исходит. Запеканка на сковороде поможет разнообразить рацион. Она получается очень вкусной. Запеканка из картофеля со свежим болгарским перцем очень аппетитно выглядит.картофель, мука пшеничная, сардельки, яйца, сыр твёрдый, помидоры, перец болгарский, зелень, соль, перец душистый молотый, масло подсолнечное;https://www.russianfood.com///img1.russianfood.com/dycontent/images_upl/144/sm_143549.jpg
Ложные чебуреки из фарша с грибами и плавленым сыром;"Интересный вариант для обеда – ложные чебуреки с грибами и сыром. Такие необычные куриные котлеты-""чебуреки"" жарятся в сковороде с минимумом растительного масла и получаются намного сочнее привычных котлет. Фарш вместо теста, а внутри – начинка из грибов и плавленого сыра. Вкусно и оригинально!фарш куриный, шампиньоны, сыр плавленый, лук репчатый, сухари панировочные, соль, перец чёрный молотый, масло растительное";https://www.russianfood.com///img1.russianfood.com/dycontent/images_upl/561/sm_560669.jpg
Паштет из куриных сердечек с морковкой и луком;Всем привет, друзья! Сегодня хочу предложить вам рецепт обалденного домашнего паштета из куриных сердечек с луком и морковкой. Получается он невероятно нежным. Подавать паштет можно как закуску, или же использовать для начинки в блины. Идеально подходит на завтрак к чаю!сердце куриное, лук репчатый, морковь, масло растительное, масло сливочное, хмели-сунели, куркума, лавровый лист, перец чёрный горошком, соль, перец чёрный молотый, вода;https://www.russianfood.com///img1.russianfood.com/dycontent/images_upl/590/sm_589093.jpg
Борщ без мяса (на сыворотке);Очень вкусный постный борщ получается благодаря добавлению сыворотки. Борщ на сыворотке выглядит ещё ярче, а его вкус более насыщенный. Сыворотка придаёт необходимую кислинку, за счёт которой хорошо сохраняется и цвет борща. Даже при отсутствии мяса, постный борщ на сыворотке очень вкусный, лёгкий, но в то же время достаточно сытный.картофель, свекла, капуста белокочанная, морковь, лук репчатый, томат-паста, сыворотка молочная, перец душистый горошком, лавровый лист, соль, масло растительное...;https://www.russianfood.com///img1.russianfood.com/dycontent/images_upl/594/sm_593114.jpg
"Закуска из солёных огурцов ""как грибы""";Из солёных огурцов, моркови и лука можно приготовить очень интересную закуску, напоминающую грибную икру. И действительно, хотя грибы не входят в состав используемых ингредиентов, их вкус и аромат улавливается. Помимо овощей нам понадобится немного майонеза для придания намазке нужной консистенции. Также добавим чеснок для аромата.огурцы солёные, лук репчатый, морковь, майонез, чеснок, соль, перец чёрный молотый, масло растительное;https://www.russianfood.com///img1.russianfood.com/dycontent/images_upl/586/sm_585537.jpg
Яичница с индейкой и помидорами;Сытный и красивый завтрак - яичница с индейкой и помидорами. Готовится такая яичница элементарно, а выглядит ярко и чрезвычайно аппетитно. Кусочки индюшиного мяса получаются невероятно нежными и сочными. Красочно, питательно и очень вкусно!филе индейки, яйца, помидоры, соль, перец чёрный молотый, зелень петрушки, масло растительное;https://www.russianfood.com///img1.russianfood.com/dycontent/images_upl/553/sm_552192.jpg
Булочки с начинкой из колбасы, помидоров и сыра;"Простой способ превратить завтрак в настоящий праздник - фаршированные булочки ""Цветочки"". Красивые и хрустящие булочки с аппетитной начинкой - это сытно, вкусно и очень симпатично!булочка, колбаса вареная, помидоры, сыр твёрдый, кетчуп";https://www.russianfood.com///img1.russianfood.com/dycontent/images_upl/585/sm_584868.jpg
Ленивые вареники с цедрой и сметанно-апельсиновым соусом;Творожные ленивые вареники — вкусный и полезный завтрак или полдник, любимый многими с детства. А если приготовить их с ароматом апельсина да со сметанно-апельсиновым соусом, то будет ещё аппетитнее. Остывшие или разогретые повторно варенички под сметанно-апельсиновым соусом по-прежнему вкусны.мука, масло сливочное, яйца, творог, цедра апельсиновая, сахар, соль, сметана, сок апельсиновый, сахар, сахар ванильный;https://www.russianfood.com///img1.russianfood.com/dycontent/images_upl/529/sm_528138.jpg
Драники с квашеной капустой;Интересный взгляд на привычное блюдо - картофельные драники с квашеной капустой. Вполне традиционное сочетание картошки и квашеной капусты в таких оригинальных драниках открывается с новой стороны. Толстенькие и сочные дранички скорее даже напоминают котлетки и получаются румяными, с аппетитной хрустящей корочкой и нежные внутри. Просто, вкусно и бюджетно!капуста квашеная, картофель, лук репчатый, мука, молоко, яйца, соль, перец чёрный молотый, масло растительное;https://www.russianfood.com///img1.russianfood.com/dycontent/images_upl/553/sm_552820.jpg
Пшённая каша с кабачками;Простое и вкусное блюдо. Пшённая каша и сочные кабачки с морковью и луком - хорошее сочетание. Неплохой вариант гарнира или вполне самостоятельное вегетарианское блюдо.пшено, кабачки, морковь, лук репчатый, соль, перец чёрный молотый, масло растительное;https://www.russianfood.com///img1.russianfood.com/dycontent/images_upl/527/sm_526107.jpg
Рис с малосольными огурцами и зеленью;Питательное блюдо для летнего меню - рис с малосольными огурцами и зеленью. Отваренный рис, малосольные огурчики, зелёный лук и укроп прекрасно сочетаются между собой. Получается лёгкий и оригинальный вегетарианский салат со сбалансированным вкусом.рис длиннозерный, огурцы малосольные, лук зелёный, зелень укропа, масло растительное, сок лимона, соль, перец чёрный молотый;https://www.russianfood.com///img1.russianfood.com/dycontent/images_upl/521/sm_520255.jpg
Вареники с брокколи и сыром фета;Если вы любите вареники, то как насчёт того, чтобы попробовать что-то необычное? Приготовим вареники из теста на сметане и яичных желтках, с начинкой из брокколи с сыром фета. Почти пюреобразная начинка придётся по вкусу поклонникам зелёной брокколи и солоноватой феты. Привычный процесс лепки и варки не удивит чем-то новым, вот вкус — наверняка.мука, желток, сметана, вода, соль, капуста брокколи, сыр фета, чеснок, соль, перец чёрный молотый, масло сливочное, лук репчатый;https://www.russianfood.com///img1.russianfood.com/dycontent/images_upl/530/sm_529028.jpg
Творожная запеканка с помидорами, яйцами и сыром;Вкусная и нежная несладкая запеканка для любителей блюд из творога. Творожно-сырно-яичная часть запеканки прекрасно сочетается c помидорами и чесноком. Разница структур двух слоёв играет ещё и разными вкусами: нежный, сливочный и слегка кислый помидорно-чесночный приятно удивят ваши вкусовые рецепторы.)помидоры, сыр пармезан, яйца, сыр фета, творог, сметана, чеснок, масло оливковое, соль, масло сливочное, базилик;https://www.russianfood.com///img1.russianfood.com/dycontent/images_upl/526/sm_525971.jpg
Яичный салат с виноградом, плавленым сыром и чесноком;Несложный и весьма оригинальный яичный салат с виноградом, плавленым сыром и чесноком. Добавление винограда привносит приятную освежающую нотку в привычное для салатов сочетание яиц и сыра. Минимум доступных ингредиентов, простое приготовление, а в результате - отличный салат с необычным сочетанием вкусов.яйца, виноград, сыр плавленый, чеснок, майонез, соль;https://www.russianfood.com///img1.russianfood.com/dycontent/images_upl/540/sm_539777.jpg
Котлеты из свеклы и яблока;Рецепт котлет из свёклы с яблоком и луком, с добавлением манной крупы. Яркие овощные котлеты с интересным вкусовым сочетанием готовятся несложно, а получаются вкусными и нежными. Яблоки обеспечивает свекольным котлеткам дополнительную сочность, аромат и приятную кислинку.свекла, яблоко, лук репчатый, крупа манная, яйца, чеснок, соль, перец чёрный молотый, масло растительное;https://www.russianfood.com///img1.russianfood.com/dycontent/images_upl/541/sm_540266.jpg
Жареные макароны с яйцом, сметаной и горчицей;Жареные макароны с яйцом, сметаной и горчицей — сытный гарнир, который можно подать самостоятельно или как дополнение к мясным и рыбным блюдам.макароны, яйца, сметана, горчица, соль, перец чёрный молотый, масло растительное;https://www.russianfood.com///img1.russianfood.com/dycontent/images_upl/596/sm_595187.jpg
Несладкий молочный суп с ломтиками запечённого риса с сыром;Очень интересное блюдо - молочный суп с ломтиками запечённого риса с сыром. Суп несладкий и не похож на остальные молочные супы. Запечённый рис с сыром напоминает фрикадельки и отлично сочетается с несладкой молочной основой с добавлением паприки. Супчик получается питательным, ароматным и очень вкусным!молоко, рис, яйца, сыр твёрдый, масло сливочное, паприка молотая, соль, сухари панировочные;https://www.russianfood.com///img1.russianfood.com/dycontent/images_upl/521/sm_520458.jpg
Постный фасолевый суп со щавелем;Постный фасолевый суп со щавелем - вкусный и лёгкий. Хотя и готовится он без мяса, но благодаря фасоли получается достаточно сытным. Свежий щавель очень хорошо дополняет блюдо, насыщает витаминами и придает приятную кислинку. Такой супчик отлично разнообразит меню!картофель, щавель, фасоль, лук репчатый, морковь, паприка молотая, куркума, соль, перец молотый, зелень петрушки, лавровый лист, масло растительное, вода;https://www.russianfood.com///img1.russianfood.com/dycontent/images_upl/509/sm_508513.jpg
Запеканка из макарон с овощами (на сковороде);Толстенькая и пышненькая запеканка из спагетти с миксом замороженных овощей и яичной заливкой – сытное и яркое блюдо! Готовить запеканку будем не в духовке, а в сковороде посредством медленного томления под крышкой. Яично-молочная смесь скрепляет макаронные изделия и кусочки овощей в единое блюдо, поэтому запеканка легко разрезается на кусочки и не распадается.спагетти, овощи мороженые, лук репчатый, яйца, молоко, масло подсолнечное, соль, перец чёрный молотый;https://www.russianfood.com///img1.russianfood.com/dycontent/images_upl/575/sm_574687.jpg
Террин из баклажанов, сладкого перца и брынзы;Невероятно красочное блюдо - террин из жареных баклажанов, запечённого болгарского перца и брынзы. Овощной террин с брынзой получается очень сытным и сочным, он станет прекрасным дополнением к другим блюдам или самостоятельной закуской. Овощной террин также можно подать и на праздничный стол, его вкус и яркость непременно оценят по достоинству.баклажан, перец болгарский, брынза, майонез, чеснок, зелень петрушки, масло оливковое, соль, перец чёрный молотый;https://www.russianfood.com///img1.russianfood.com/dycontent/images_upl/352/sm_351205.jpg
Слоёные пирожки с куриной печенью и яйцом (в духовке);"Сегодня я вам предлагаю приготовить вкусные и сытные слоёные пирожки с куриной печенью, яйцом и зеленью. Тесто используем магазинное, но начинку приготовим самостоятельно, причем, не поскупимся — сделаем ""щедрые"" пирожки. Куриная печень прекрасно подойдёт для начинки пирожков, она гармонирует с яйцами и зеленью. Такие пирожки можно взять с собой на перекус или подать в качестве завтрака, с чашечкой чая будет очень вкусно!)тесто слоеное, масло растительное, мука, печень куриная, лук репчатый, морковь, зелень петрушки, лук зелёный, соль, перец чёрный молотый, масло растительное, яйца, желток";https://www.russianfood.com///img1.russianfood.com/dycontent/images_upl/532/sm_531700.jpg
Картофельные зразы на манке, с сыром;Картофельные зразы наполняют разной начинкой. На этот раз приготовим их с сыром — плавким, нежным и тягучим. Просто заворачиваем сырную начинку в картофельное тесто с добавлением манной крупы. А после дело остаётся за малым — обжарить на сковороде до румяности уже готовые по сути продукты. Просто? — Да. Вкусно? — Ещё бы!картофель, сыр твёрдый, крупа манная, яйца, мука, масло сливочное, масло растительное, травы пряные, соль, перец чёрный молотый;https://www.russianfood.com///img1.russianfood.com/dycontent/images_upl/534/sm_533835.jpg
Жареные лепёшки с тыквой;Яркие и очень простые в приготовлении жареные лепёшки на кефире, из тончайшего теста с хрустящими краями и большим количеством ароматнейшей пряной начинки. Такие лепешки никого не оставят равнодушным и позволят совсем по-новому взглянуть на блюда из тыквы.мука, кефир, соль, масло растительное, тыква, лук репчатый, масло сливочное, томат-паста, сахар, соус соевый, соль, перец красный молотый, чеснок, масло растительное;https://www.russianfood.com///img1.russianfood.com/dycontent/images_upl/369/sm_368376.jpg
"""Жареная"" манная каша";"Обычную манку можно очень легко превратить в весьма оригинальное блюдо. ""Жареная"" манная каша - прекрасное тому доказательство. Манная крупа, обжаренная со специями, приобретает ореховые нотки и по вкусу напоминает булгур, а по консистенции - кускус. Бюджетно, вкусно и питательно!крупа манная, паприка молотая, соль, перец чёрный молотый";https://www.russianfood.com///img1.russianfood.com/dycontent/images_upl/518/sm_517507.jpg
Тушёная капуста с яйцами (на сковороде);Простая и вкусная еда - тушёная капуста с яйцами. Добавление яичной смеси в сочную тушёную капусту с морковью и луком обеспечивает сытность. Прекрасный гарнир или вполне самостоятельное овощное блюдо.капуста белокочанная, лук репчатый, морковь, яйца, крупа манная, соль, перец чёрный молотый, масло растительное;https://www.russianfood.com///img1.russianfood.com/dycontent/images_upl/506/sm_505341.jpg
