Навание блюда;Состав;Картинка
"Жареная картошка с ""мексиканской смесью""";Картофель, жаренный со смесью замороженных овощей, - отличный гарнир к мясу или сытное, яркое и ароматное самостоятельное блюдо для постного меню. В качестве овощной смеси прекрасно подойдёт мексиканская, которая включает морковь, сладкий перец, кукурузу, стручковую фасоль,  зелёный горошек и сельдерей. С таким овощным набором жареная картошечка только выигрывает как по вкусу, так и внешне - в тарелке блюдо смотрится ярко и очень аппетитно!картофель, смесь овощная, порошок чесночный, травы сухие итальянские, соль, перец чёрный молотый, масло растительное;https://www.russianfood.com///img1.russianfood.com/dycontent/images_upl/499/sm_498707.jpg
Сосиски в воздушном тесте;"Всего полчаса - и очень оригинальный завтрак из самых простых продуктов будет на столе! Это вариация на тему британского блюда ""жабки в норке"", где тесто красиво растрескивается во время выпечки, образуя воздушные корзиночки вокруг начинки.сосиски, мука пшеничная, яйца, молоко, масло растительное, соль";https://www.russianfood.com///img1.russianfood.com/dycontent/images_upl/348/sm_347361.jpg
Сконы с корейской морковью и зеленью (на кефире);Очень вкусная, необычная и предельно простая в приготовлении выпечка - сконы на кефире, с корейской морковью, жареным луком и зеленью. Упрощённая версия знаменитой английской выпечки - на кефире, да ещё и с сочной овощной начинкой. Рекомендую: аппетитно, сытно и совсем несложно!мука, кефир, яйца, масло растительное, разрыхлитель, сахар, соль, морковка корейская, лук репчатый, зелень петрушки, зелень укропа, масло растительное;https://www.russianfood.com///img1.russianfood.com/dycontent/images_upl/401/sm_400881.jpg
Картофельные лепёшки-драники с сыром и зеленью;Необычные блюдо из тёртого картофеля, очень похожее на драники. Румяные картофельные блинчики с нежной начинкой из сыра и свежего укропа. Такие аппетитные драники с лихвой окупят потраченные на их приготовление усилия! Съедаются мгновенно - со сметаной они прелесть как хороши!картофель, сыр твёрдый, зелень укропа, соль, перец чёрный молотый, масло растительное, сметана;https://www.russianfood.com///img1.russianfood.com/dycontent/images_upl/415/sm_414900.jpg
Ленивые мини-пиццы в булочках;Если хочется пиццы, а желания возиться с тестом нет - на помощь придёт этот простой и замечательный рецепт. Хрустящие булочки с сочной начинкой из мяса и овощей под сырной корочкой хоть и не похожи на пиццу внешне, но их вкус очень напоминает это многими любимое блюдо.булочка, буженина, сыр моцарелла, помидоры черри, перец болгарский, оливки, соус томатный, базилик, зелень петрушки;https://www.russianfood.com///img1.russianfood.com/dycontent/images_upl/349/sm_348406.jpg
Пирог из лаваша с картофелем, творогом и сыром (на сковороде);"Оригинальный ""ленивый пирог"" из лаваша с картофелем, творогом и сыром фета готовится на сковороде и получается невероятно вкусным и сытным. Такой пирог немного похож на пироги из слоёного теста. Попробуйте приготовить!лаваш, картофель, творог, сыр, яйца, молоко, соль, перец чёрный молотый, зелень петрушки, масло растительное";https://www.russianfood.com///img1.russianfood.com/dycontent/images_upl/385/sm_384035.jpg
Блины на рассоле, с сырной начинкой;На огуречном рассоле получаются замечательные тонкие блинчики, которые отлично сочетаются практически с любой несладкой начинкой! В данном варианте в качестве начинки используется твёрдый сыр - он плавится во время обжаривания и блинчики получаются ещё вкуснее!рассол огуречный, мука, яйца, сахар, масло растительное, сода, перец чёрный молотый, сыр твёрдый;https://www.russianfood.com///img1.russianfood.com/dycontent/images_upl/408/sm_407485.jpg
Лепёшки на кефире, с картофелем, морковью и луком;Отличный рецепт простых и быстрых лепёшек на сковороде. Хрустящий припёк из картофеля, моркови и лука делает нежные и воздушные лепёшки похожими на пирожки, только в ленивом варианте, так как жидкое тесто на кефире замешивается элементарно и его не нужно раскатывать. К первым блюдам или в качестве перекуса такие лепёшечки разлетятся враз!мука, кефир, яйца, сода, соль, картофель, лук репчатый, морковь, мука, соль, перец чёрный молотый, масло растительное;https://www.russianfood.com///img1.russianfood.com/dycontent/images_upl/392/sm_391944.jpg
Печенье с орехами и джемом;Нежное рассыпчатое печенье с орехами и джемом выглядит очень привлекательно и замечательно на вкус. Такое печенье можно приготовить для праздничного стола.масло сливочное, мука, орех грецкий, джем клюквенный, сахар, яйца, сахар ванильный, соль;https://www.russianfood.com///img1.russianfood.com/dycontent/images_upl/213/sm_212338.jpg
Луковые гренки с сыром;Аппетитные румяные гренки с поджаристой ароматной луково-сырной корочкой наверняка понравятся даже тем, кто не очень любит жареный лук. Луковые гренки с сыром получаются очень вкусными - отличное блюдо для перекуса, завтрака и даже ужина!хлеб для тостов, лук репчатый, сыр твёрдый, соль, масло растительное;https://www.russianfood.com///img1.russianfood.com/dycontent/images_upl/402/sm_401344.jpg
Лепёшки с сыром сулугуни (на сковороде);Приготовьте лепёшки из дрожжевого теста, с сыром сулугуни, к завтраку, обеду или ужину. Времени для их приготовления потребуется всего полчаса, а удовольствие от аппетитных лепёшек с золотистой корочкой и нежной начинкой из сыра сулугуни гарантировано.тесто дрожжевое, сыр сулугуни, масло растительное, мука;https://www.russianfood.com///img1.russianfood.com/dycontent/images_upl/296/sm_295357.jpg
Салат из моркови с яблоком, орехами и вяленой клюквой;Чудесный витаминный салат из сочной свежей моркови с яблоком и грецкими орехами обладает отменным вкусом. Без сомнений - сама польза!морковь, яблоко, клюква, орех грецкий, майонез, сок лимона, сахар, соль;https://www.russianfood.com///img1.russianfood.com/dycontent/images_upl/316/sm_315442.jpg
Сосиски в тесте (на сковороде);Сосиски в тесте на скорую руку и без всякого фритюра - это возможно! Приготовьте такие сочные и вкусные сосисочки в хрустящем тесте на обычной сковороде утром в выходной - и, уверяю, что долго будить членов семьи к завтраку вам точно не придётся!сосиски, мука пшеничная, кефир, сода, соль, масло растительное;https://www.russianfood.com///img1.russianfood.com/dycontent/images_upl/348/sm_347297.jpg
Несладкая овсянка в банке, с творогом и помидорами;Слоёная овсянка с творогом и помидорами, рецепт приготовления которой я хочу вам показать сегодня - это не только быстрый, сытный и полезный завтрак! Такая овсяная каша готовится с вечера прямо в банке, её можно взять с собой для перекуса на работу или, скажем, в поездку, что очень практично и удобно. Каша получается сбалансированной, очень ароматной и вкусной.помидоры, творог, хлопья овсяные, зелень петрушки, масло растительное, соль, перец чёрный молотый;https://www.russianfood.com///img1.russianfood.com/dycontent/images_upl/430/sm_429552.jpg
Молодой картофель, запечённый с беконом и яйцами;Молодой картофель, запечённый с копчёным беконом и яйцами, –  простое в приготовлении, сытное и вкусное блюдо, которое придётся по вкусу всей семье. Отличный вариант обеда, ужина или питательного позднего завтрака. Попробуйте!картофель молодой, яйца, бекон, масло оливковое, перец чёрный молотый, соль, зелень укропа;https://www.russianfood.com///img1.russianfood.com/dycontent/images_upl/328/sm_327902.jpg
Яичный салат с морковью и луком;Вкусный и яркий салат из доступных ингредиентов – яичный салат с морковью и луком. Яйца, овощи и зелень – прекрасное сочетание. Приготовить несложно, а получается очень сытная и ароматная закуска.морковь, яйца, лук зелёный, сметана, соль, перец чёрный молотый;https://www.russianfood.com///img1.russianfood.com/dycontent/images_upl/592/sm_591322.jpg
Шоколадный пирог без сахара и муки;Нежнейший пирог всего из четырёх ингредиентов. Этот шоколадный пирог готовится не только без шоколада, но и без муки, масла и сахара. Своим необычным цветом пирог обязан вовсе не красителям, а сочетанию вполне доступных продуктов - бананов и какао. А главное - хоть в составе и нет молокопродуктов, пирог и по вкусу, и по текстуре очень похож на творожную запеканку. Просто, вкусно и оригинально!банан, яйца, какао-порошок, разрыхлитель;https://www.russianfood.com///img1.russianfood.com/dycontent/images_upl/589/sm_588086.jpg
Гренки с плавленым сыром и зеленью;Простая и очень вкусная намазка для бутербродов - плавленый сыр с зеленью. Подайте такую нежнейшую пасту из плавленых сырков, укропа, петрушки и зелёного лука на хрустящих ломтиках ржаного хлеба, обжаренных на сковороде - получится великолепная закуска на все случаи жизни! Несложно, быстро и вполне оригинально - стоит взять на заметку!хлеб ржаной, сыр плавленый, зелень петрушки, зелень укропа, лук зелёный, соль, перец чёрный молотый, масло растительное;https://www.russianfood.com///img1.russianfood.com/dycontent/images_upl/403/sm_402523.jpg
Лепёшки на кефире, с колбасой и сыром;Простые несладкие лепёшки на кефире, с колбасой и сыром - отличное решение, чтобы быстро перекусить. Рецепт таких лепёшек на кефире - очень доступный и лёгкий. Лепёшки быстро жарятся и станут замечательной альтернативой привычным бутербродам с сыром и колбасой.мука пшеничная, кефир, колбаса, сыр твёрдый, зелень укропа, соль, разрыхлитель, сахар, масло растительное;https://www.russianfood.com///img1.russianfood.com/dycontent/images_upl/384/sm_383973.jpg
Омлет с картофелем, горошком и помидорами;Омлет с картофелем, консервированным горошком и помидорами получается настолько ярким и аппетитным, что устоять перед ним просто невозможно. За счёт добавления картофеля и горошка омлет получается чрезвычайно сытным, а помидоры и лук придают сочность и аромат. Попробуйте приготовить!яйца, картофель, помидоры, горошек зелёный консервированный, лук репчатый, масло растительное, соль, перец чёрный молотый;https://www.russianfood.com///img1.russianfood.com/dycontent/images_upl/360/sm_359036.jpg
Яичница в кляре;Оригинальный завтрак из простых продуктов - необычные оладьи-яичницы! Яичница обжаривается в кляре на основе кефира - получается что-то очень похожее на сочные и мягкие пирожки или оладьи с интересной начинкой. Невероятно вкусно!яйца, соль, кефир, мука, яйца, травы пряные, карри, сода, соль, масло растительное;https://www.russianfood.com///img1.russianfood.com/dycontent/images_upl/385/sm_384249.jpg
Пюре из перловой крупы и картофеля, с жареным луком;Сытный и простой гарнир из самых доступных продуктов - пюре из перловой крупы и картофеля, с добавлением жареного лука. Оригинальное и бюджетное блюдо, приготовить которое очень легко. Пюре получается очень нежным и интересным на вкус, а обжаренный лук отлично дополняет такое необычное блюдо, делая его ещё вкуснее и питательнее.картофель, перловка, лук репчатый, соль, перец чёрный молотый, масло растительное, вода;https://www.russianfood.com///img1.russianfood.com/dycontent/images_upl/463/sm_462602.jpg
Сырное суфле;В традиционное суфле из яиц добавляю два вида сыра и запекаю в духовке. Шикарное блюдо для всей семьи.желток, белок, сыр камамбер, сыр пармезан, стебель сельдерея, лук зелёный, чеснок, масло сливочное, мука, порошок горчичный, соль, перец чёрный молотый, молоко...;https://www.russianfood.com///img1.russianfood.com/dycontent/images_upl/45/sm_44389.jpg
Яичница с сыром в хлебе;Удивите домашних необычным завтраком, приготовив эффектную яичницу с сыром, поджаренную в кусочках багета. Понадобится всего четыре ингредиента и 15 минут времени - просто, оригинально и очень вкусно! Попробуйте!яйца, багет Французский, сыр твёрдый, масло сливочное, соль;https://www.russianfood.com///img1.russianfood.com/dycontent/images_upl/379/sm_378713.jpg
Горячие бутерброды с творогом (в духовке);Оригинальные бутерброды с творогом, приготовленные в духовке по этому рецепту, ещё называют ленивыми ватрушками. Они и правда по вкусу чем-то напоминают их, хотя готовятся в разы быстрее и проще. Для завтрака - отличный вариант!хлеб белый, творог, молоко, яйца, сахар;https://www.russianfood.com///img1.russianfood.com/dycontent/images_upl/383/sm_382759.jpg
Быстрый хот-дог;Сытная и быстрая замена обеду. Горячая булка с сосисками, корейской морковкой и сыром съедается моментально.булочка, сосиски, сыр, морковка корейская, майонез, кетчуп;https://www.russianfood.com///img1.russianfood.com/dycontent/images_upl/125/sm_124662.jpg
Смузи из свёклы с кефиром и зеленью;Смузи из свёклы, кефира и зелени за счёт шикарного глубокого малинового цвета выглядит ярко и эффектно. Этот густой полезный свекольный напиток вмиг утолит голод и зарядит организм энергией! Рецепт отлично подойдёт и тем, кто придерживается принципов правильного питания и следит за своей фигурой, и просто желающим пополнить запас витаминов.свекла, кефир, зелень укропа, лук зелёный, соль, перец чёрный молотый;https://www.russianfood.com///img1.russianfood.com/dycontent/images_upl/357/sm_356064.jpg
Рулетики из лаваша с ветчиной, сладким перцем и сыром;"Простой и очень вкусный завтрак из лаваша - рулетики с аппетитной начинкой из ветчины, варёного яйца и болгарского перца, под ""шапочкой"" из расплавленного сыра. Если отварить яйцо заранее, такой несложный и сытный перекус можно приготовить всего за несколько минут.лаваш, ветчина, перец сладкий, яйца, сыр твёрдый, лук зелёный, зелень петрушки, кетчуп, майонез, масло растительное";https://www.russianfood.com///img1.russianfood.com/dycontent/images_upl/387/sm_386042.jpg
Оладьи на сметане, с фаршем;Эти оладьи с фаршем вполне можно назвать ленивыми беляшами, ведь по вкусу они действительно очень похожи на беляши, однако готовятся намного быстрее и проще. Такие мясные оладушки на сметане по достоинству оценят любители сытных блюд!фарш мясной, сметана, мука пшеничная, яйца, разрыхлитель, соль, масло растительное;https://www.russianfood.com///img1.russianfood.com/dycontent/images_upl/390/sm_389746.jpg
Гренки с морковью и варёными яйцами;Яркая намазка из сырой моркови и варёных яиц - быстрый и бюджетный вариант закуски, которая прекрасно сочетается с хрустящими гренками. Морковно-яичная намазка получается нежной и имеет интересный и очень приятный вкус. Такая закуска понравится даже тем, кто не особо любит сырую морковь.морковь, яйца, майонез, соль, перец чёрный молотый, хлеб белый, масло растительное;https://www.russianfood.com///img1.russianfood.com/dycontent/images_upl/581/sm_580822.jpg
Зразы из гречневой каши с варёным яйцом и зелёным луком;Великолепная альтернатива гречневой каше на завтрак или применение уже приготовленной гречки - необычные зразы с начинкой из варёного яйца и зелёного лука. Готовятся они, конечно, немного дольше привычной гречневой каши, зато результат стоит затраченных усилий на все сто.крупа гречневая, яйца, лук зелёный, мука, сметана, соль, перец чёрный молотый, масло растительное;https://www.russianfood.com///img1.russianfood.com/dycontent/images_upl/356/sm_355410.jpg
Тушёный картофель с яйцами и зеленью;Вкусная и бюджетная еда - тушёный картофель с яйцами. Картофель, яйца, лук и немного укропа - вот и всё, что понадобится для этого простого и сытного блюда. Приготовить его совсем несложно - картофель, тушенный в сковороде вместе с обжаренным луком, заливается яйцами, посыпается ароматным свежим укропом и немного томится до полной готовности. Отличный гарнир или вполне самостоятельное блюдо!картофель, лук репчатый, яйца, зелень укропа, соль, масло сливочное;https://www.russianfood.com///img1.russianfood.com/dycontent/images_upl/497/sm_496984.jpg
